{
  "schema_version": "1.0",
  "event_id": "event-001",
  "timestamp": "2026-07-26T00:00:00Z",
  "trace_id": "trace-001",
  "request_id": "req-001",
  "decision_id": "decision-001",
  "component": "pdp",
  "event_type": "authorization_decision",
  "subject_id": "agent.front_office.fraud",
  "runtime_subject_id": "fraud_agent",
  "resource_id": "resource.front_office.transaction_history",
  "runtime_resource_id": "transaction_history",
  "action": "read",
  "workflow_id": "workflow.front_office.fraud_review",
  "decision": "ALLOW_WITH_OBLIGATIONS",
  "policy_version": "example-version",
  "permit_id": null,
  "outcome": "success",
  "reason": "Matched fraud read policy",
  "obligations": [{"type": "enhanced_logging", "parameters": {}}],
  "latency_ms": 1.2,
  "environment": "prototype",
  "details": {}
}
